{
  "id": "trail-mate",
  "name": "Trail Mate",
  "version": "v0.1.15-alpha",
  "tagline": "Offline LoRa team comms and GPS positioning for outdoor crews.",
  "description": "Offline-first LoRa team messaging and GPS positioning for outdoor scenarios.",
  "boards": [
    { "brand": "lilygo", "model": "t-lora-pager", "label": "T-LoRa Pager" },
    { "brand": "lilygo", "model": "t-deck", "label": "T-Deck" }
  ],
  "mcu": ["esp32"],
  "features": ["mesh", "team", "gps"],
  "scenes": ["offline-comms", "rescue", "convoy", "hiking"],
  "trust": "verified",
  "release_channel": "preview",
  "support": "supported",
  "featured": true,
  "publisher": {
    "name": "Trail Mate",
    "github": "vicliu624",
    "repo": "https://github.com/vicliu624/trail-mate"
  },
  "release": {
    "date": "2026-04-16",
    "notes": "https://github.com/vicliu624/trail-mate/releases/tag/v0.1.15-alpha"
  },
  "artifacts": [
    {
      "file": "trail-mate-tlora_pager_sx1262-v0.1.15-alpha.bin",
      "type": "bin",
      "url": "https://github.com/vicliu624/trail-mate/releases/download/v0.1.15-alpha/trail-mate-tlora_pager_sx1262-v0.1.15-alpha.bin",
      "flash_url": "assets/firmware/trail-mate-tlora_pager_sx1262-v0.1.15-alpha.bin",
      "sha256": "8e53582f3d6df3c6d9ce573ae9fcf7eb5759607befb3696147dd0bceda2b03c5",
      "size": 3655584,
      "variant": "tlora_pager_sx1262",
      "boards": [
        { "brand": "lilygo", "model": "t-lora-pager", "label": "T-LoRa Pager" }
      ]
    },
    {
      "file": "trail-mate-tdeck-v0.1.15-alpha.bin",
      "type": "bin",
      "url": "https://github.com/vicliu624/trail-mate/releases/download/v0.1.15-alpha/trail-mate-tdeck-v0.1.15-alpha.bin",
      "flash_url": "assets/firmware/trail-mate-tdeck-v0.1.15-alpha.bin",
      "sha256": "10f21204df3d1243dbb8f8951379059d118d1da00310d51277b85a0a4a33b12f",
      "size": 3200080,
      "variant": "tdeck",
      "boards": [
        { "brand": "lilygo", "model": "t-deck", "label": "T-Deck" }
      ]
    }
  ],
  "poster": {
    "hero": "assets/posters/trail-mate.png"
  },
  "story": [
    "Outdoor activities often take place in environments where cellular networks are unreliable or completely unavailable. In these conditions, people still need to exchange short text messages, understand relative positions, and maintain basic orientation without depending entirely on smartphones or complex infrastructure.",
    "Trail Mate is a low-power, offline-first handheld device project built on ESP32-class hardware, designed specifically to address these constraints.",
    "It focuses on two core needs in offline outdoor scenarios: reliable self-positioning with a fixed north-up GPS map, and direct LoRa text communication that connects to Meshtastic networks without relying on a smartphone. Trail Mate prioritizes stability, efficiency, and interoperability over feature density or visual polish."
  ]
}
